{
  "name": "check-schedules-on-open",
  "trigger": "on_workspace_open",
  "action": "prompt",
  "prompt": "Session started. Please do the following:\n1. Use memory_context to load relevant background for this workspace\n2. CRITICAL: Use schedule_check_pending to find any tasks that are due NOW\n3. If there are pending tasks, you MUST execute them:\n   - Read the task description carefully\n   - Execute the task as instructed (research, browse, notify, etc.)\n   - Use schedule_mark_done to mark the task completed\n4. Briefly greet the user and summarize what was done\n\nImportant: Scheduled tasks do NOT execute automatically. You are the executor. When you see pending tasks, ACT on them immediately.",
  "enabled": true,
  "requires_confirmation": false,
  "description": "On workspace open: load context, check for pending scheduled tasks, EXECUTE them, and greet user"
}
