{
  "name": "execute-scheduled-tasks",
  "trigger": "on_schedule_trigger",
  "action": "prompt",
  "prompt": "A scheduled task is due for execution. Please do the following:\n1. Use schedule_queue_pending to ensure all due tasks are queued (this catches overdue/missed tasks too)\n2. Use schedule_get_pending_executions to see what's in the queue\n3. Use schedule_get_missed_executions to check for overlooked tasks\n4. For each pending execution:\n   - Use schedule_claim_execution to claim the task\n   - READ the task description carefully\n   - EXECUTE the task as instructed (research, browse, notify, etc.)\n   - Use schedule_complete_execution to mark it done with a result summary\n5. Continue until the queue is empty\n\nThe execution queue ensures tasks are NEVER missed, even if checked late. Always queue first, then work through the queue.",
  "enabled": true,
  "requires_confirmation": false,
  "notify_on_complete": true,
  "notify_channel": "telegram",
  "description": "Execute pending scheduled tasks using the execution queue pattern (queue → claim → execute → complete)"
}
