{
  "name": "check-schedules-on-open",
  "trigger": "on_workspace_open",
  "action": "prompt",
  "prompt": "Session started. Please do the following:\n1. Use memory_context to load relevant background\n2. CRITICAL: Use schedule_queue_pending to queue any due/overdue tasks to the execution queue\n3. Use schedule_get_pending_executions to see waiting tasks\n4. Use schedule_get_missed_executions to catch any overlooked tasks\n5. For each pending execution:\n   - Use schedule_claim_execution to claim it\n   - EXECUTE the task description\n   - Use schedule_complete_execution to mark it done\n6. Briefly greet the user and summarize what was executed\n\nImportant: The execution queue ensures tasks are NEVER missed - even if you're late, queue_pending will catch overdue tasks. You are the executor - ACT on pending tasks immediately.",
  "enabled": true,
  "requires_confirmation": false,
  "description": "On workspace open: load context, queue pending tasks to execution queue, EXECUTE them, and greet user"
}
